Seller Platform,Seller SKu,Manufacture,Manufacture Code,Product Title,Description,Packaging,Qty,Category,Subcategories,Product Page URL,Attachment,Image URL
BoiHorizon,IHA,BoiHorizon,,Internal Hex Analog,,,,Intra-Lock,Intrahex,https://usstore.biohorizons.com/internal-hex-analog,,https://vsr.biohorizons.com/GetProductImage?path=Medium&sku=IHA
BoiHorizon,MDLPA,BoiHorizon,,MDL® Castable Abutment,,,,Intra-Lock,MDL,https://usstore.biohorizons.com/mdl-castable-abutment-2,,https://vsr.biohorizons.com/GetProductImage?path=Medium&sku=MDLPA
BoiHorizon,IH3710,BoiHorizon,,"Internal Hex Compatible Implant, Ø3.75mm x 10mm",Body Diameter3.75mmLength10mm,,,Intra-Lock,Intrahex,https://usstore.biohorizons.com/internal-hex-compatible-implant-%C3%B8375mm-x-10mm,,https://vsr.biohorizons.com/GetProductImage?path=Medium&sku=IH3710
BoiHorizon,ISSA2,BoiHorizon,,"Straight Abutment 2mm Collar, SQ Platform, w/ Retaining Screw",,,,Intra-Lock,InDex,https://usstore.biohorizons.com/straight-abutment-2mm-collar-sq-platform-w-retaining-screw,,https://vsr.biohorizons.com/GetProductImage?path=Medium&sku=ISSA2
BoiHorizon,MO-C0.5DOM,BoiHorizon,,MinerOss-Cortical & Cancellous Chips 0.5cc,MinerOss is a mixture of mineralized cortical and cancellous bone chips. The cortical component provides structural integrity and space-maintaining capability. The cancellous component’s porous architecture promotes osteoconduction and rapid revascularization.,,,Biologics,MinerOss Family,https://usstore.biohorizons.com/mineross-cortical-cancellous-chips-05cc-5,,https://vsr.biohorizons.com/GetProductImage?path=Medium&sku=MO-C0.5DOM
BoiHorizon,I4711STI,BoiHorizon,,"Wide Platform, Ø4.75mm x 11.5mm Blossom™ Implant, Short Collar",Body Diameter4.75mmLength11.5mm,,,Intra-Lock,InDex,https://usstore.biohorizons.com/wide-platform-%C3%B8475mm-x-115mm-blossom-implant-short-collar,,https://vsr.biohorizons.com/GetProductImage?path=Medium&sku=I4711STI
BoiHorizon,MO-C1.0DOM,BoiHorizon,,MinerOss-Cortical & Cancellous Chips 1.0cc,MinerOss is a mixture of mineralized cortical and cancellous bone chips. The cortical component provides structural integrity and space-maintaining capability. The cancellous component’s porous architecture promotes osteoconduction and rapid revascularization.,,,Biologics,MinerOss Family,https://usstore.biohorizons.com/mineross-cortical-cancellous-chips-10cc-5,,https://vsr.biohorizons.com/GetProductImage?path=Medium&sku=MO-C1.0DOM
BoiHorizon,L02028,BoiHorizon,,Guided Surgery Kit Catalog & Manual (CGS4000),,,,Support Materials,Product Literature,https://usstore.biohorizons.com/guided-surgery-kit-catalog-manual-cgs4000,,https://vsr.biohorizons.com/GetProductImage?path=Medium&sku=L02028
BoiHorizon,PGRHA5,BoiHorizon,00847236005344,"Internal 4.5 Regular Healing Abutment, 5mm Height","Used for tissue healing at second-stage uncovery or as a transmucosal element for single-stage procedures. Flares approximately 1mm wider in diameter than the platform of the implant. Hand-tighten with the .050"" (1.25mm) Hex Driver.Collar Height5mmSurfaceStandardEmergenceRegularPlatform Diameter4.5mm (Green)",,,Prosthetics,Healing Abutments,https://usstore.biohorizons.com/internal-45-regular-emergence-healing-abutment-5mm-height,,https://vsr.biohorizons.com/GetProductImage?path=Medium&sku=PGRHA5
BoiHorizon,RCM-ML3040,BoiHorizon,00813954020761,Resorbable Collagen Membrane 30mm x 40mm,Mem-Lok Resorbable Collagen Membrane is a highly purified type I collagen to provide an increased resorption period and ensure optimal bone regeneration. Predictable resorption rate of 26-38 weeks.Cell occlusive membrane prevents soft tissue ingrowth.Macromolecular pore size allows vital nutrient transfer.Handling CharacteristicsSpace Maintenance,,,Biologics,Mem-Lok Family,https://usstore.biohorizons.com/resorbable-collagen-membrane-30mm-x-40mm,,https://vsr.biohorizons.com/GetProductImage?path=Medium&sku=RCM-ML3040
BoiHorizon,ML0315,BoiHorizon,,BioHorizons TeethXpress Patient Education Magazine,"BioHorizons created TeethXpress magazine to help you educate prospective and existing patients about dental implants and regenerative treatment. An educated patient is more likely to follow through on treatment recommendations, therefore increasing case acceptance.The current edition includes 20+ real patient testimonials, an effective form of patient education and case acceptance. The “Celebrities with dental implants” and “Financing your implant treatment” articles remain patient favorites. Newly addedcontent reassures patients that the dental office has always been safe and is now even safer. To further put patients at ease, magazines are individually wrapped.Provide the magazine to patients in advance of their appointment or upon arrival, during consultations and during patient seminars. Include them in take-home folders and encourage them to share the information with family members. Also, give them to your referring doctors too! Handing out copies of this uniquely helpful marketing tool will benefit both your practice and theirs, as patients become better acquainted with the benefits of dental implant and regenerative treatment.Patient Education MaterialsPrinted Materials",,,Support Materials,Patient Education,https://usstore.biohorizons.com/biohorizons-teethxpress-patient-education-magazine,,https://vsr.biohorizons.com/GetProductImage?path=Medium&sku=ML0315
BoiHorizon,TP3HA3,BoiHorizon,00847236010683,"3.0mm Healing Abutment, 3mm Height","Used for tissue healing at second-stage uncovery or as a transmucosal element for single-stage procedures. Emergence is the same diameter as the platform of the implant. Hand-tighten with the .050"" (1.25mm) Hex Driver.Collar Height3mmSurfaceStandardEmergenceRegularPlatform Diameter3.0mm (Gray)",,,Prosthetics,Healing Abutments,https://usstore.biohorizons.com/30mm-healing-abutment-3mm-height,,https://vsr.biohorizons.com/GetProductImage?path=Medium&sku=TP3HA3
